<?xml version="1.0" encoding="UTF-8"?>

<zahtev_za_sertifikat xmlns="http://www.ftn.uns.ac.rs/zahtev-za-sertifikat/"
    xmlns:xs="http://www.w3.org/2001/XMLSchema#"
    xmlns:xsi="http://www.w3.org/2001/XMLSchema-instance"
    xmlns:pred="http://www.ftn.uns.ac.rs/rdf/predicate/"
    xsi:schemaLocation="http://www.ftn.uns.ac.rs/zahtev-za-sertifikat/ zahtev_za_sertifikat.xsd" 
    about="http://www.ftn.uns.ac.rs/zahtev-za-sertifikat/0234567891234">
    
    <meta_podaci>
        <mesto_izdavanja property="pred:ima_mesto_izdavanja" datatype="xs:string">Novi Sad</mesto_izdavanja>
        <datum_izdavanja property="pred:ima_datum_izdavanja" datatype="xs:string">2021-10-01</datum_izdavanja>
        <status_zahteva property="pred:ima_status" datatype="xs:string">NA CEKANJU</status_zahteva>
    </meta_podaci>
    
    <podnosilac_zahteva about="http://www.ftn.uns.ac.rs/licni-podaci/0234567891234">
        <ime_prezime property="pred:se_zove" datatype="xs:string">Petar Petrović</ime_prezime>
        <datum_rodjenja property="pred:je_rodjen" datatype="xs:string">1987-01-01</datum_rodjenja>
        <pol property="pred:ima_pol" datatype="xs:string">M</pol>
        <jmbg property="pred:ima_jmbg" datatype="xs:string">0234567891234</jmbg>
        <broj_pasosa property="pred:ima_broj_pasosa" datatype="xs:string">123456789</broj_pasosa>
        <razlog_za_podnosenje_zahteva>Lični zahtev</razlog_za_podnosenje_zahteva>
    </podnosilac_zahteva>
    
</zahtev_za_sertifikat>